{
  "version": 2,
  "target_id": "river_reflection",
  "object_name": "sunlight reflection on river",
  "animation_prompt": "river reflections shimmering in response to sunlight",
  "enabled": true,
  "mask_verified": false,
  "target_role": "reflection",
  "envelope_group": "sunlight",
  "audio_driver": "beat",
  "motion_source": "procedural",
  "motion_type": "still",
  "on_beat_flicker": 0.42,
  "off_beat_flicker": 0.18,
  "on_beat_motion": 0.0,
  "off_beat_motion": 0.0,
  "generated_motion_strength": 0.85,
  "max_luminance_change": 0.1,
  "glow_strength": 0.0,
  "glow_radius_px": 0.0,
  "saturation_variation": 0.05,
  "hue_variation_degrees": -2.0,
  "secondary_audio_driver": "hihat",
  "secondary_driver_mix": 0.34,
  "response_attack_ms": 80.0,
  "response_decay_ms": 330.0,
  "response_hold_ms": 50.0,
  "response_sustain": 0.12,
  "response_release_ms": 620.0,
  "response_smoothing": 0.26,
  "response_min": 0.03,
  "response_max": 0.88,
  "response_sensitivity": 0.94,
  "response_curve": 0.92,
  "rhythmic_subdivision": 2,
  "accent_weight": 0.12,
  "group_gain": 0.86,
  "group_delay_ms": 180.0,
  "lighting_gain": 1.8,
  "edge_glow_enabled": true,
  "edge_glow_amount": 0.1,
  "shimmer_enabled": true,
  "shimmer_amount": 0.32,
  "section_response": 0.42
}
